{
  "version": "0.1.0",
  "title": "Norway’s Scenic Camper Route · Geiranger–Trollstigen",
  "preset": "tiktok",
  "aspectRatio": "9:16",
  "fps": 30,
  "output": {
    "bitrateMbps": 20,
    "showSafeArea": false,
    "includeBranding": false
  },
  "scenes": [
    {
      "id": "hook",
      "type": "title",
      "durationMs": 1200,
      "headline": "104 km. Norway’s wildest camper road.",
      "image": "https://equilibriumpress.github.io/GeoLibre/project-data/norway-scenic-camper-route/trollstigen.jpg",
      "transition": "cut",
      "camera": {
        "center": [7.37, 62.28],
        "zoom": 3.2,
        "pitch": 0,
        "bearing": 0,
        "transitionMs": 0
      }
    },
    {
      "id": "norway",
      "type": "map",
      "durationMs": 1600,
      "transition": "fly",
      "camera": {
        "center": [7.37, 62.28],
        "zoom": 6.3,
        "pitch": 20,
        "bearing": 0,
        "transitionMs": 1400
      }
    },
    {
      "id": "route-overview",
      "type": "map",
      "durationMs": 1500,
      "headline": "Geiranger → Trollstigen",
      "transition": "fly",
      "camera": {
        "center": [7.37, 62.28],
        "zoom": 8.1,
        "pitch": 40,
        "bearing": 0,
        "transitionMs": 1200
      },
      "cues": [
        {
          "kind": "layer",
          "atMs": 0,
          "layerId": "norway-camper-route",
          "visible": true,
          "opacity": 1
        }
      ]
    },
    {
      "id": "drive-to-flydalsjuvet",
      "type": "map",
      "durationMs": 2900,
      "routeLayerId": "norway-camper-route",
      "routeFollow": {
        "samples": 5,
        "zoom": 10.6,
        "pitch": 45,
        "startFraction": 0,
        "endFraction": 0.18402284
      }
    },
    {
      "id": "flydalsjuvet-stop",
      "type": "map",
      "durationMs": 1600,
      "sourceStoryChapterId": "flydalsjuvet",
      "transition": "cut",
      "camera": {
        "center": [7.223597, 62.089302],
        "zoom": 11.7,
        "pitch": 45,
        "bearing": 0,
        "transitionMs": 0
      }
    },
    {
      "id": "drive-to-ornesvingen",
      "type": "map",
      "durationMs": 2400,
      "routeLayerId": "norway-camper-route",
      "routeFollow": {
        "samples": 4,
        "zoom": 10.6,
        "pitch": 45,
        "startFraction": 0.18402284,
        "endFraction": 0.28842264
      }
    },
    {
      "id": "ornesvingen-stop",
      "type": "map",
      "durationMs": 1600,
      "sourceStoryChapterId": "ornesvingen",
      "transition": "cut",
      "camera": {
        "center": [7.16721732, 62.12626334],
        "zoom": 11.7,
        "pitch": 45,
        "bearing": 0,
        "transitionMs": 0
      }
    },
    {
      "id": "drive-to-gudbrandsjuvet",
      "type": "map",
      "durationMs": 3700,
      "routeLayerId": "norway-camper-route",
      "routeFollow": {
        "samples": 9,
        "zoom": 10.6,
        "pitch": 45,
        "startFraction": 0.28842264,
        "endFraction": 0.67044887
      }
    },
    {
      "id": "gudbrandsjuvet-stop",
      "type": "map",
      "durationMs": 1600,
      "sourceStoryChapterId": "gudbrandsjuvet",
      "transition": "cut",
      "camera": {
        "center": [7.471132, 62.330758],
        "zoom": 11.7,
        "pitch": 45,
        "bearing": 0,
        "transitionMs": 0
      }
    },
    {
      "id": "drive-to-trollstigen",
      "type": "map",
      "durationMs": 4600,
      "routeLayerId": "norway-camper-route",
      "routeFollow": {
        "samples": 10,
        "zoom": 10.6,
        "pitch": 45,
        "startFraction": 0.67044887,
        "endFraction": 0.85689331
      }
    },
    {
      "id": "trollstigen-stop",
      "type": "map",
      "durationMs": 3000,
      "sourceStoryChapterId": "trollstigen",
      "transition": "cut",
      "camera": {
        "center": [7.663136, 62.453301],
        "zoom": 11.7,
        "pitch": 45,
        "bearing": 0,
        "transitionMs": 0
      }
    },
    {
      "id": "outro",
      "type": "cta",
      "durationMs": 800,
      "headline": "Would you drive this?",
      "transition": "fly",
      "camera": {
        "center": [7.37, 62.28],
        "zoom": 8.2,
        "pitch": 40,
        "bearing": 0,
        "transitionMs": 700
      }
    },
    {
      "id": "loop-frame",
      "type": "conclusion",
      "durationMs": 500,
      "image": "https://equilibriumpress.github.io/GeoLibre/project-data/norway-scenic-camper-route/trollstigen.jpg",
      "transition": "cut",
      "camera": {
        "center": [7.37, 62.28],
        "zoom": 3.2,
        "pitch": 0,
        "bearing": 0,
        "transitionMs": 0
      }
    }
  ],
  "audio": {
    "music": "",
    "musicVolume": 0.12,
    "narrationVolume": 1
  }
}
